name,url,description,type
Digital Advertising (New),https://www.shl.com/solutions/products/product-catalog/view/digital-advertising-new/,Digital Advertising (New): Multi-choice test that measures the candidate's knowledge about use of AdWords and tools to analyze ad performance on digital media.,Knowledge & Skills
WriteX - Email Writing (Sales) (New),https://www.shl.com/solutions/products/product-catalog/view/writex-email-writing-sales-new/,"WriteX - Email Writing (Sales) (New): Open response test that evaluates the ability to write proper emails in English. The test provides scores on content, grammar and email etiquette.     Your use…",Knowledge & Skills
SHL Verify Interactive Numerical Calculation,https://www.shl.com/solutions/products/product-catalog/view/shl-verify-interactive-numerical-calculation/,SHL Verify Interactive Numerical Calculation: The Verify Interactive Numerical Calculation test measures a candidate’s ability to work with numbers and use appropriate mathematics in different situations…,Knowledge & Skills
Professional + 7.1 (International),https://www.shl.com/solutions/products/product-catalog/view/professional-7-1-solution/,"Professional + 7.1 (International): Our Professional + 7.1 solution is designed for all non-managerial professional individual contributor positions, and includes SHL’s new innovative…",Knowledge & Skills
SQL Server Analysis Services (SSAS) (New),https://www.shl.com/solutions/products/product-catalog/view/sql-server-analysis-services-%28ssas%29-%28new%29/,"SQL Server Analysis Services (SSAS) (New): Multi-choice test that measures the knowledge of SSAS database, querying multidimensional analysis solutions, cube hierarchies, measures, dimensions, power BI…",Knowledge & Skills
Python (New),https://www.shl.com/solutions/products/product-catalog/view/python-new/,"Python (New): Multi-choice test that measures the knowledge of Python programming, databases, modules and library.",Knowledge & Skills
Tableau (New),https://www.shl.com/solutions/products/product-catalog/view/tableau-new/,"Tableau (New): Multi-choice test that measures the knowledge of how to use Tableau to prepare tables, create visualizations, perform calculations, apply filters and carry out…",Knowledge & Skills
Microsoft Excel 365 (New),https://www.shl.com/solutions/products/product-catalog/view/microsoft-excel-365-new/,"Microsoft Excel 365 (New): The Microsoft Excel 365 simulation evaluates ability to perform certain operations in a simulated environment of MS Excel, and includes the following topics…",Knowledge & Skills
Professional + 7.0 Solution,https://www.shl.com/solutions/products/product-catalog/view/professional-7-0-solution-3958/,"Professional + 7.0 Solution: Our Professional + 7.0 solution is designed for all non-managerial professional individual contributor positions, and includes SHL’s new innovative…",Knowledge & Skills
Data Warehousing Concepts,https://www.shl.com/solutions/products/product-catalog/view/data-warehousing-concepts/,"Data Warehousing Concepts: The Data Warehousing Concepts test measures knowledge of Data Warehousing. Designed for experienced users, this test covers the following topics: Big Data and…",Knowledge & Skills
