name,url,description,type
SQL Server Analysis Services (SSAS) (New),https://www.shl.com/products/product-catalog/view/sql-server-analysis-services-%28ssas%29-%28new%29/,"SQL Server Analysis Services (SSAS) (New): Multi-choice test that measures the knowledge of SSAS database, querying multidimensional analysis solutions, cube hierarchies, measures, dimensions, power BI…",Knowledge & Skills
SQL Server Integration Services (SSIS) (New),https://www.shl.com/products/product-catalog/view/sql-server-integration-services-ssis-new/,"SQL Server Integration Services (SSIS) (New): Multi-choice test that measures the knowledge of SSIS architecture, components, control flow, data flow, transformation, SQL server tasks, SSIS administration…",Knowledge & Skills
SQL Server Reporting Services (SSRS) (New),https://www.shl.com/products/product-catalog/view/sql-server-reporting-services-ssrs-new/,"SQL Server Reporting Services (SSRS) (New): Multi-choice test that measures the knowledge of SSRS architecture, report creation, formatting, calculations, creating matrix reports and charts, grouping…",Knowledge & Skills
Statistical Analysis System (New),https://www.shl.com/products/product-catalog/view/statistical-analysis-system-new/,Statistical Analysis System (New): Multi-choice test that measures the ability to use the SAS software for statistical analysis.,Knowledge & Skills
Struts (New),https://www.shl.com/products/product-catalog/view/struts-new/,"Struts (New): Multi-choice test that measures the knowledge of Struts framework, configuration, validations, actions and interceptors.",Knowledge & Skills
SVAR - Spoken English (AUS),https://www.shl.com/products/product-catalog/view/svar-spoken-english-aus/,"SVAR - Spoken English (AUS): An automated spoken English test that measures fluency, pronunciation, active listening, vocabulary, grammar and spoken English understanding.     Your use of…",Knowledge & Skills
SVAR - Spoken English (Indian Accent) (New),https://www.shl.com/products/product-catalog/view/svar-spoken-english-indian-accent-new/,"SVAR - Spoken English (Indian Accent)  (New): An automated spoken English test that measures fluency, pronunciation, active listening, vocabulary, grammar and spoken English understanding.     Your use of…",Knowledge & Skills
SVAR - Spoken English (U.K.),https://www.shl.com/products/product-catalog/view/svar-spoken-english-u-k/,"SVAR - Spoken English (U.K.): An automated spoken English test that measures fluency, pronunciation, active listening, vocabulary, grammar and spoken English understanding.     Your use of…",Knowledge & Skills
SVAR - Spoken English (US) (New),https://www.shl.com/products/product-catalog/view/svar-spoken-english-us-new/,"SVAR - Spoken English (US)  (New): An automated spoken English test that measures fluency, pronunciation, active listening, vocabulary, grammar and spoken English understanding.     Your use of…",Knowledge & Skills
SVAR - Spoken French (Canadian) (New),https://www.shl.com/products/product-catalog/view/svar-spoken-french-canadian-new/,"SVAR - Spoken French (Canadian) (New): Test automatisé de français parlé qui évalue l'aisance, la prononciation, l'écoute active, le vocabulaire, la grammaire, et la compréhension du français parl…",Knowledge & Skills
SVAR - Spoken French (European) (New),https://www.shl.com/products/product-catalog/view/svar-spoken-french-european-new/,"SVAR - Spoken French (European) (New): Test automatisé de français parlé qui évalue l'aisance, la prononciation, l'écoute active, le vocabulaire, la grammaire, et la compréhension du français parl…",Knowledge & Skills
SVAR - Spoken Spanish (Castilian) (New),https://www.shl.com/products/product-catalog/view/svar-spoken-spanish-castilian-new/,"SVAR - Spoken Spanish (Castilian) (New): Test automatizado de español oral que mide la fluidez, la pronunciación, la escucha activa, el vocabulario, la gramática y la comprensión oral del español…",Knowledge & Skills
SVAR - Spoken Spanish (North American) (New),https://www.shl.com/products/product-catalog/view/svar-spoken-spanish-north-american-new/,"SVAR - Spoken Spanish (North American) (New): Test automatizado de español oral que mide la fluidez, la pronunciación, la escucha activa, el vocabulario, la gramática y la comprensión oral del español…",Knowledge & Skills
Swing (New),https://www.shl.com/products/product-catalog/view/swing-new/,"Swing (New): Multi-choice test that measures the knowledge of components, containers, layouts and event handling in Swing.",Knowledge & Skills
Tableau (New),https://www.shl.com/products/product-catalog/view/tableau-new/,"Tableau (New): Multi-choice test that measures the knowledge of how to use Tableau to prepare tables, create visualizations, perform calculations, apply filters and carry out…",Knowledge & Skills
Telecommunications Engineering (New),https://www.shl.com/products/product-catalog/view/telecommunications-engineering-new/,"Telecommunications Engineering (New): Multi-choice test that measures the knowledge of analog communication, digital communication, electromagnetism and microwave engineering.",Knowledge & Skills
Teradata Development (New),https://www.shl.com/products/product-catalog/view/teradata-development-new/,"Teradata Development (New): Multi-choice test that measures the knowledge on Teradata concepts of RDBMS components, performance availability features, utilities, workload management…",Knowledge & Skills
Time Management (U.S.),https://www.shl.com/products/product-catalog/view/time-management-u-s/,Time Management (U.S.): This is an adaptive test that measures the candidate's knowledge of how to use time wisely in the workplace. It is designed for the average business worker and…,Knowledge & Skills
Training Development,https://www.shl.com/products/product-catalog/view/training-development/,"Training Development: The Training Development test measures knowledge of developing and delivering training programs. Designed for experienced trainers, this test covers the…",Knowledge & Skills
Typing (New),https://www.shl.com/products/product-catalog/view/typing-new/,Typing (New): Typing based test that evaluates typing speed and accuracy.,Knowledge & Skills
UiPath RPA Development (New),https://www.shl.com/products/product-catalog/view/uipath-rpa-development-new/,"UiPath RPA Development (New): Multi-choice test that measures the knowledge on UiPath architecture, workflows recording, UI interaction, automation, and orchestrator.",Knowledge & Skills
Universal Competency Framework Interview Guide,https://www.shl.com/products/product-catalog/view/universal-competency-framework-interview-guide/,Universal Competency Framework Interview Guide: The UCF Interview Guide provides a structured way of gathering information about each candidate and their competency potential across the 20 UCF Dimensions…,Knowledge & Skills
Universal Competency Framework Job profiling guide,https://www.shl.com/products/product-catalog/view/universal-competency-framework-job-profiling-guide/,Universal Competency Framework Job profiling guide: The SHL Universal Competency Framework establishes a common language for competencies that underpins SHL’s products and services. It is a single underlying…,Knowledge & Skills
Universal Competency Framework Profiler Cards (44),https://www.shl.com/products/product-catalog/view/universal-competency-framework-profiler-cards-44/,"Universal Competency Framework Profiler Cards (44): The UCF sets out the key behaviours that drive performance using a standard, proven hierarchy that can be applied to virtually any job at any level, in any…",Knowledge & Skills
UNIX (New),https://www.shl.com/products/product-catalog/view/unix-new/,"UNIX (New): Multi-choice test that measures the knowledge on the concepts of UNIX commands, file system, file handling, regular expression, awk programming and shell…",Knowledge & Skills
VB.NET (New),https://www.shl.com/products/product-catalog/view/vb-net-new/,"VB.NET (New): Multi-choice test that measures the knowledge on the concepts of VB.NET assemblies, OOPs concepts, ADO.NET, multithreading, exception handling and GUI.",Knowledge & Skills
Verify - Deductive Reasoning,https://www.shl.com/products/product-catalog/view/verify-deductive-reasoning/,Verify - Deductive Reasoning: The Verify Deductive Reasoning Test is an online ability assessment that can be used to support both pre- and post-hire assessment processes. It enables…,Knowledge & Skills
Verify - Following Instructions,https://www.shl.com/products/product-catalog/view/verify-following-instructions/,Verify - Following Instructions: This test measures a candidate's ability to follow detailed instructions and then select the correct course of action. Candidates are presented with a set of…,Knowledge & Skills
Verify - G+,https://www.shl.com/products/product-catalog/view/verify-g/,"Verify - G+: The G+ test is part of the Verify suite of cognitive ability tests. The test is designed to measure three types of ability: Numerical, Deductive, and…",Knowledge & Skills
Verify - General Ability Screen,https://www.shl.com/products/product-catalog/view/verify-general-ability-screen/,"Verify - General Ability Screen: The General Ability Screen is a first for us – a measure of general mental ability or ‘g’ .  Targeted at ‘entry-level’ roles, General Ability Screen is…",Knowledge & Skills
Verify - Inductive Reasoning (2014),https://www.shl.com/products/product-catalog/view/verify-inductive-reasoning-2014/,Verify - Inductive Reasoning (2014): Inductive Reasoning is a test used for job candidates applying to jobs at all levels that require logical reasoning ability. Sample tasks for jobs that may…,Knowledge & Skills
Verify - Numerical Ability,https://www.shl.com/products/product-catalog/view/verify-numerical-ability/,Verify - Numerical Ability: The next-generation Verify Numerical Ability Test provides a replacement for the existing Numerical Reasoning test in our Verify range of ability tests and the…,Knowledge & Skills
Verify - Technical Checking - Next Generation,https://www.shl.com/products/product-catalog/view/verify-technical-checking-next-generation/,Verify - Technical Checking - Next Generation: The Technical Checking assessment is part of the Verify suite of cognitive ability assessments. Technical Checking measures perceptual speed and accuracy. This…,Knowledge & Skills
Verify - Verbal Ability - Next Generation,https://www.shl.com/products/product-catalog/view/verify-verbal-ability-next-generation/,"Verify - Verbal Ability - Next Generation: The Verbal Ability test measures the ability to read written passages and comprehend the text, interpret tone and author intent, identify main ideas, and…",Knowledge & Skills
Verify - Working with Information,https://www.shl.com/products/product-catalog/view/verify-working-with-information/,Verify - Working with Information: This test measures a candidate's ability to process information. Candidates are given information in different table formats and are asked to use the…,Knowledge & Skills
Verify G+ - Ability Test Report,https://www.shl.com/products/product-catalog/view/verify-g-ability-test-report/,"Verify G+ - Ability Test Report: The SHL Verify G+ Ability Test Report provides the candidate's overall General Ability score alongside scores on Numerical, Deductive and Inductive Reasoning…",Knowledge & Skills
Verify G+ - Candidate Report,https://www.shl.com/products/product-catalog/view/verify-g-candidate-report/,"Verify G+ - Candidate Report: The SHL Verify G+ Ability Candidate Report provides the candidate with feedback on their Numerical, Deductive and Inductive Reasoning results. It does not…",Knowledge & Skills
Verify Interactive Ability Report,https://www.shl.com/products/product-catalog/view/verify-interactive-ability-report/,Verify Interactive Ability Report: Verify Interactive Ability Report,Knowledge & Skills
Verify Interactive G+ Candidate Report,https://www.shl.com/products/product-catalog/view/verify-interactive-g-candidate-report/,Verify Interactive G+ Candidate Report: Verify Interactive G+ Candidate Report,Knowledge & Skills
Verify Interactive G+ Report,https://www.shl.com/products/product-catalog/view/verify-interactive-g-report/,Verify Interactive G+ Report: Report for Verify Interactive G+,Knowledge & Skills
Automata - Fix (New),https://www.shl.com/solutions/products/product-catalog/view/automata-fix-new/,"Automata - Fix (New): A simulated compiler integrated test to measure debugging skills in C, C++ and Java. The test checks the ability to fix logical or syntactical errors and to…",Knowledge & Skills
Core Java (Entry Level) (New),https://www.shl.com/solutions/products/product-catalog/view/core-java-entry-level-new/,"Core Java (Entry Level) (New): Multi-choice test that measures the knowledge of basic Java constructs, OOP concepts, file handling, exception handling, threads, generic class and inner class.",Knowledge & Skills
Java 8 (New),https://www.shl.com/solutions/products/product-catalog/view/java-8-new/,"Java 8 (New): Multi-choice test that measures the knowledge of Java class design, exceptions, generics, collections, concurrency, JDBC and Java I/O fundamentals.",Knowledge & Skills
Core Java (Advanced Level) (New),https://www.shl.com/solutions/products/product-catalog/view/core-java-advanced-level-new/,"Core Java (Advanced Level) (New): Multi-choice test that measures the knowledge of basic Java constructs, OOP concepts, files and exception handling, and advanced Java concepts like generics…",Knowledge & Skills
Interpersonal Communications,https://www.shl.com/products/product-catalog/view/interpersonal-communications/,Interpersonal Communications: This adaptive test measures the candidate's knowledge of how to employ effective verbal and non-verbal communication to send his or her message and manage…,Knowledge & Skills
Entry level Sales 7.1 (International),https://www.shl.com/solutions/products/product-catalog/view/entry-level-sales-7-1/,Entry level Sales 7.1 (International): The Entry Level Sales 7.1 Solution is for entry-level positions in which employees proactively sell products or services to customers and have their…,Knowledge & Skills
Entry Level Sales Sift Out 7.1,https://www.shl.com/solutions/products/product-catalog/view/entry-level-sales-sift-out-7-1/,Entry Level Sales Sift Out 7.1: The Entry Level Sales Sift Out 7.1 Solution is for entry-level positions in which employees proactively sell products or services to customers and have their…,Knowledge & Skills
Entry Level Sales Solution,https://www.shl.com/solutions/products/product-catalog/view/entry-level-sales-solution/,Entry Level Sales Solution: The Precise Fit Entry Level Sales Roles Solution is for entry-level positions in which employees proactively sell products or services to customers and have…,Knowledge & Skills
Sales Representative Solution,https://www.shl.com/solutions/products/product-catalog/view/sales-representative-solution/,Sales Representative Solution: The Sales Representative solution is for entry-level sales positions in which employees proactively sell products to customers and have their pay and/or…,Knowledge & Skills
Business Communication (adaptive),https://www.shl.com/products/product-catalog/view/business-communication-adaptive/,Business Communication (adaptive): This is an adaptive test that measures knowledge of communicating in the workplace. It measures the skills necessary to communicate effectively with coworkers…,Knowledge & Skills
Technical Sales Associate Solution,https://www.shl.com/solutions/products/product-catalog/view/technical-sales-associate-solution/,Technical Sales Associate Solution: The Technical Sales Associate solution is for entry-level retail positions in which employees proactively sell a specific line of products that requires…,Knowledge & Skills
SVAR - Spoken English (Indian Accent) (New),https://www.shl.com/solutions/products/product-catalog/view/svar-spoken-english-indian-accent-new/,"SVAR - Spoken English (Indian Accent)  (New): An automated spoken English test that measures fluency, pronunciation, active listening, vocabulary, grammar and spoken English understanding.     Your use of…",Knowledge & Skills
English Comprehension (New),https://www.shl.com/solutions/products/product-catalog/view/english-comprehension-new/,"English Comprehension (New): Multiple-choice test that measures vocabulary, grammar and reading comprehension skills.",Knowledge & Skills
Enterprise Leadership Report 1.0,https://www.shl.com/products/product-catalog/view/enterprise-leadership-report/,Enterprise Leadership Report 1.0: Assess and benchmark your leaders against enterprise leadership - the model for leader impact to drive business results in a complex work environment.  For…,Knowledge & Skills
OPQ Leadership Report,https://www.shl.com/solutions/products/product-catalog/view/opq-leadership-report/,OPQ Leadership Report: This OPQ (Occupational Personality Questionnaire) report provides a detailed analysis of an individual's leadership potential.  It is based on SHL's leading…,Knowledge & Skills
OPQ Team Types and Leadership Styles Report,https://www.shl.com/solutions/products/product-catalog/view/opq-team-types-and-leadership-styles-report,OPQ Team Types and Leadership Styles Report: This OPQ (Occupational Personality Questionnaire) report is based on Belbin's team types and Bass's leadership and reporting styles.  Belbins team types…,Knowledge & Skills
Enterprise Leadership Report 2.0,https://www.shl.com/products/product-catalog/view/enterprise-leadership-report-2-0/,Enterprise Leadership Report 2.0: Assess and benchmark your leaders against enterprise leadership - the model for leader impact to drive business results in a complex work environment.  For…,Knowledge & Skills
Global Skills Assessment,https://www.shl.com/solutions/products/product-catalog/view/global-skills-assessment/,Global Skills Assessment: The Global Skills Assessment (GSA) is an assessment used to measure 96 discrete skills/behaviors. These 96 skill scores are directly aligned to the most…,Knowledge & Skills
Verify - Verbal Ability - Next Generation,https://www.shl.com/solutions/products/product-catalog/view/verify-verbal-ability-next-generation/,"Verify - Verbal Ability - Next Generation: The Verbal Ability test measures the ability to read written passages and comprehend the text, interpret tone and author intent, identify main ideas, and…",Knowledge & Skills
SHL Verify Interactive - Inductive Reasoning,https://www.shl.com/solutions/products/product-catalog/view/shl-verify-interactive-inductive-reasoning/,SHL Verify Interactive - Inductive Reasoning: Evaluates ability to identify specific patterns in data or situations and generalize that information to broader contexts.,Knowledge & Skills
Marketing (New),https://www.shl.com/solutions/products/product-catalog/view/marketing-new/,"Marketing (New): Multi-choice test that measures the conceptual knowledge of marketing principles, market research, consumer behavior, brand management, sales management…",Knowledge & Skills
English Comprehension (New),https://www.shl.com/products/product-catalog/view/english-comprehension-new/,"English Comprehension (New): Multiple-choice test that measures vocabulary, grammar and reading comprehension skills.",Knowledge & Skills
Drupal (New),https://www.shl.com/solutions/products/product-catalog/view/drupal-new/,"Drupal (New): Multi-choice test that measures the knowledge of Drupal setup, content management, user interface, module development and security.",Knowledge & Skills
Written English v1,https://www.shl.com/solutions/products/product-catalog/view/written-english-v1/,Written English v1: The Written English test measures knowledge of US English grammar and English reading comprehension. It is designed for those with English as a second language…,Knowledge & Skills
Occupational Personality Questionnaire OPQ32r,https://www.shl.com/solutions/products/product-catalog/view/occupational-personality-questionnaire-opq32r/,"Occupational Personality Questionnaire OPQ32r: The SHL Occupational Personality Questionnaire, the OPQ32, is one of the most widely used and respected measures of workplace behavioural style in the world…",Knowledge & Skills
Search Engine Optimization (New),https://www.shl.com/solutions/products/product-catalog/view/search-engine-optimization-new/,"Search Engine Optimization (New): Multi-choice test that measures the knowledge on the concepts of need of SEO, SEO planning, SEO strategies, SEO software, tools and exchanging links.",Knowledge & Skills
Automata Selenium,https://www.shl.com/solutions/products/product-catalog/view/automata-selenium/,Automata Selenium: A coding simulation assessment that evaluates the ability to conduct tasks related to automation testing using Selenium scripts.,Knowledge & Skills
Professional + 7.1 (International),https://www.shl.com/products/product-catalog/view/professional-7-1-solution/,"Professional + 7.1 (International): Our Professional + 7.1 solution is designed for all non-managerial professional individual contributor positions, and includes SHL’s new innovative…",Knowledge & Skills
JavaScript (New),https://www.shl.com/solutions/products/product-catalog/view/javascript-new/,JavaScript (New): Multi-choice test that measures knowledge of programming in the JavaScript language and its application in front-end development.,Knowledge & Skills
HTML/CSS (New),https://www.shl.com/solutions/products/product-catalog/view/htmlcss-new/,HTML/CSS (New): Multi-choice test that measures the knowledge of HTML to create a user interface and CSS to stylize it.,Knowledge & Skills
CSS3 (New),https://www.shl.com/solutions/products/product-catalog/view/css3-new/,CSS3 (New): Multi-choice test that measures the knowledge of CSS3 and its application in providing style to web documents.,Knowledge & Skills
Selenium (New),https://www.shl.com/solutions/products/product-catalog/view/selenium-new/,"Selenium (New): Multi-choice test that measures the knowledge of Selenium IDE, Selenium RC, Selenium grid, web driver, test design considerations, user extensions, frameworks…",Knowledge & Skills
SQL Server (New),https://www.shl.com/solutions/products/product-catalog/view/sql-server-new/,"SQL Server (New): Multi-choice test that measures the knowledge of basic SQL queries, creating and altering tables, filtering, grouping, aggregation in SQL and querying multiple…",Knowledge & Skills
Automata - SQL (New),https://www.shl.com/solutions/products/product-catalog/view/automata-sql-new/,"Automata - SQL (New): A simulated query writing test that measures the ability to write SQL queries to perform DDL, DML and DCL tasks.",Knowledge & Skills
Manual Testing (New),https://www.shl.com/solutions/products/product-catalog/view/manual-testing-new/,"Manual Testing (New): Multi-choice test that measures the knowledge of the software testing life cycle, testing tools and techniques, design of test cases and generation of test…",Knowledge & Skills
Administrative Professional - Short Form,https://www.shl.com/solutions/products/product-catalog/view/administrative-professional-short-form/,Administrative Professional - Short Form: The Administrative Professional solution is for entry to mid-level positions that involve routine clerical and administrative functions in addition to office…,Knowledge & Skills
Verify - Numerical Ability,https://www.shl.com/solutions/products/product-catalog/view/verify-numerical-ability/,Verify - Numerical Ability: The next-generation Verify Numerical Ability Test provides a replacement for the existing Numerical Reasoning test in our Verify range of ability tests and the…,Knowledge & Skills
Financial Professional - Short Form,https://www.shl.com/solutions/products/product-catalog/view/financial-professional-short-form/,Financial Professional - Short Form: This solution is for mid-level financial institution positions that require Series 6/7 certification. Candidates answer multiple choice questions to measure…,Knowledge & Skills
Bank Administrative Assistant - Short Form,https://www.shl.com/solutions/products/product-catalog/view/bank-administrative-assistant-short-form/,Bank Administrative Assistant - Short Form: The Administrative Assistant solution is for entry-level clerical positions that interact with external or internal customers. Sample tasks for these jobs…,Knowledge & Skills
General Entry Level – Data Entry 7.0 Solution,https://www.shl.com/solutions/products/product-catalog/view/general-entry-level-data-entry-7-0-solution/,General Entry Level – Data Entry 7.0 Solution: Our General Entry Level – Data Entry 7.0 solution is designed for entry-level positions that include entering data into computers or data management systems…,Knowledge & Skills
Basic Computer Literacy (Windows 10) (New),https://www.shl.com/solutions/products/product-catalog/view/basic-computer-literacy-windows-10-new/,"Basic Computer Literacy (Windows 10) (New): The Basic Computer Literacy (Windows 10) simulation measures knowledge of general computer terminology, processes, and applications and the ability to perform…",Knowledge & Skills
Manager 8.0+ JFA,https://www.shl.com/solutions/products/product-catalog/view/manager-8-0-jfa-4310/,Manager 8.0+ JFA: The Manager 8.0+ Job-Focused Assessment is designed for candidates applying to their first leadership positions and includes SHL’s new innovative mobile-first…,Knowledge & Skills
Microsoft Excel 365 - Essentials (New),https://www.shl.com/solutions/products/product-catalog/view/microsoft-excel-365-essentials-new/,"Microsoft Excel 365 - Essentials (New): The Microsoft Excel 365 - Essentials simulation evaluates ability to perform certain operations in a simulated environment of MS Excel, and includes the…",Knowledge & Skills
