name,url,description,type
Administrative Professional - Short Form,https://www.shl.com/products/product-catalog/view/administrative-professional-short-form/,Administrative Professional - Short Form: The Administrative Professional solution is for entry to mid-level positions that involve routine clerical and administrative functions in addition to office…,Knowledge & Skills
Apprentice + 8.0 Job Focused Assessment,https://www.shl.com/products/product-catalog/view/apprentice-8-0-job-focused-assessment-4261/,"Apprentice + 8.0 Job Focused Assessment: The Apprentice + 8.0 Job-Focused Assessment is a short, targeted, globally applicable assessment which includes a short cognitive ability measure. This…",Knowledge & Skills
Apprentice 8.0 Job Focused Assessment,https://www.shl.com/products/product-catalog/view/apprentice-8-0-job-focused-assessment/,"Apprentice 8.0 Job Focused Assessment: The Apprentice 8.0 Job-Focused Assessment is a short, targeted, globally applicable assessment. This assessment is designed for entry-level positions…",Knowledge & Skills
Bank Administrative Assistant - Short Form,https://www.shl.com/products/product-catalog/view/bank-administrative-assistant-short-form/,Bank Administrative Assistant - Short Form: The Administrative Assistant solution is for entry-level clerical positions that interact with external or internal customers. Sample tasks for these jobs…,Knowledge & Skills
Bank Collections Agent - Short Form,https://www.shl.com/products/product-catalog/view/bank-collections-agent-short-form/,Bank Collections Agent - Short Form: This solution is for entry-level collections positions in an inbound or outbound call center environment in a financial setting. Candidates answer multiple…,Knowledge & Skills
Bank Operations Supervisor - Short Form,https://www.shl.com/products/product-catalog/view/bank-operations-supervisor-short-form/,Bank Operations Supervisor - Short Form: The Bank Operations Supervisor solution is for job candidates applying to entry-level leadership positions who tend to supervise hourly employees. Sample tasks…,Knowledge & Skills
"Bookkeeping, Accounting, Auditing Clerk Short Form",https://www.shl.com/products/product-catalog/view/bookkeeping-accounting-auditing-clerk-short-form/,"Bookkeeping, Accounting, Auditing Clerk Short Form: The Bookkeeping, Accounting, and Auditing Clerk solution is for entry-level positions that involve entering numerical data into computer systems and…",Knowledge & Skills
Branch Manager - Short Form,https://www.shl.com/products/product-catalog/view/branch-manager-short-form/,Branch Manager - Short Form: This solution is for mid to upper-level financial institution managerial positions. Candidates answer a series of multiple choice questions to measure…,Knowledge & Skills
Global Skills Development Report,https://www.shl.com/products/product-catalog/view/global-skills-development-report/,"Global Skills Development Report : This report is designed to be given to individuals who have completed the Global Skills Assessment (GSA). With coverage across the Great 8 Domains, this…",Knowledge & Skills
.NET Framework 4.5,https://www.shl.com/products/product-catalog/view/net-framework-4-5/,".NET Framework 4.5: The.NET Framework 4.5 test measures knowledge of .NET environment. Designed for experienced users, this test covers the following topics: Application…",Knowledge & Skills
.NET MVC (New),https://www.shl.com/products/product-catalog/view/net-mvc-new/,".NET MVC (New): Multi-choice test that measures the knowledge of Model-View-Controller (MVC) architecture, validation, security, routing, and areas.",Knowledge & Skills
.NET MVVM (New),https://www.shl.com/products/product-catalog/view/net-mvvm-new/,".NET MVVM (New): Multi-choice test that measures the knowledge of MVVM pattern, scenarios, data validation, ViewModel communication and Quick-start.",Knowledge & Skills
.NET WCF (New),https://www.shl.com/products/product-catalog/view/net-wcf-new/,".NET WCF (New): Multi-choice test that measures the knowledge of .NET fundamentals, WCF architecture, programming model, SOA, managing and programming WCF.",Knowledge & Skills
.NET WPF (New),https://www.shl.com/products/product-catalog/view/net-wpf-new/,".NET WPF (New): Multi-choice test that measures the knowledge of .NET basics, WPF, XAML controls, events, layouts, working with WPF windows/menus and deploying WPF…",Knowledge & Skills
.NET XAML (New),https://www.shl.com/products/product-catalog/view/net-xaml-new/,".NET XAML (New): Multi-choice test that measures the knowledge of XAML triggers, data binding, custom controls and layouts.",Knowledge & Skills
Accounts Payable (New),https://www.shl.com/products/product-catalog/view/accounts-payable-new/,"Accounts Payable (New): Multiple-choice test that measures the knowledge of processing payables and vendor invoices, and the posting of journal entries.",Knowledge & Skills
Accounts Payable Simulation (New),https://www.shl.com/products/product-catalog/view/accounts-payable-simulation-new/,Accounts Payable Simulation (New): Simulated data entry test that measures the ability to process payables and vendor invoices.,Knowledge & Skills
Accounts Receivable (New),https://www.shl.com/products/product-catalog/view/accounts-receivable-new/,Accounts Receivable (New): Multiple-choice test that measures the knowledge of processing receivables and invoices.,Knowledge & Skills
Accounts Receivable Simulation (New),https://www.shl.com/products/product-catalog/view/accounts-receivable-simulation-new/,Accounts Receivable Simulation (New): Simulated data entry test that measures the ability to process receivables and invoices.,Knowledge & Skills
ADO.NET (New),https://www.shl.com/products/product-catalog/view/ado-net-new/,"ADO.NET (New): Multi-choice test that measures the knowledge on the concepts of ADO.NET architecture, components and data provider objects.",Knowledge & Skills
Contact Center Customer Service + 8.0,https://www.shl.com/products/product-catalog/view/contact-center-customer-service-8-0/,"Contact Center Customer Service + 8.0: The Contact Center + 8.0 - Customer Service Job Focused Assessment is designed to measure the skills, competencies, and behaviors needed for success in contact…",Knowledge & Skills
Contact Center Customer Service 8.0,https://www.shl.com/products/product-catalog/view/contact-center-customer-service-8-0-4269/,Contact Center Customer Service 8.0  : The Customer Service 8.0 JFA is designed for entry-level positions in a contact center environment where the main focus is customer service.,Knowledge & Skills
Contact Center Manager - Short Form,https://www.shl.com/products/product-catalog/view/contact-center-manager-short-form/,"Contact Center Manager - Short Form: The Contact Center - Manager solution is for mid to upper-level contact center managerial positions. Sample  tasks for these jobs include, but are not limited…",Knowledge & Skills
Contact Center Sales & Service + 8.0,https://www.shl.com/products/product-catalog/view/contact-center-sales-and-service-8-0/,"Contact Center Sales & Service + 8.0 : The Contact Center + 8.0 - Sales & Service Job Focused Assessment is designed to measure the skills, competencies, and behaviors needed for success in contact…",Knowledge & Skills
Contact Center Sales & Service 8.0,https://www.shl.com/products/product-catalog/view/contact-center-sales-and-service-8-0-4268/,Contact Center Sales & Service 8.0 : The Sales & Service 8.0 JFA is designed for contact center roles that involve sales or sales-related behaviors such as recommending products or services and…,Knowledge & Skills
Contact Center Team Lead/Coach - Short Form,https://www.shl.com/products/product-catalog/view/contact-center-team-leadcoach-short-form/,Contact Center Team Lead/Coach - Short Form: The Contact Center - Team Lead/Coach solution is for job candidates applying to entry-level leadership  positions who tend to supervise hourly employees…,Knowledge & Skills
Customer Service - Short Form,https://www.shl.com/products/product-catalog/view/customer-service-short-form/,Customer Service - Short Form: The Customer Service Representative Solution is for entry-level positions that involve a high degree of interaction with customers in person or on the phone…,Knowledge & Skills
Customer Service - Short Form - UK,https://www.shl.com/products/product-catalog/view/customer-service-short-form-uk/,Customer Service - Short Form - UK: The Customer Service Representative solution is for entry-level positions that involve  a high degree of interaction with customers in person or on the phone…,Knowledge & Skills
Customer Service with Sales - Short Form,https://www.shl.com/products/product-catalog/view/customer-service-with-sales-short-form/,Customer Service with Sales - Short Form: The Customer Service with Sales solution is for entry-level positions that involve both providing service and support to customers and selling goods and…,Knowledge & Skills
Director - Short Form,https://www.shl.com/products/product-catalog/view/director-short-form/,"Director - Short Form: The Director solution is intended for use with senior level positions responsible for the planning, directing, or coordinating key business activities and…",Knowledge & Skills
MFS 360 Enterprise Leadership Report,https://www.shl.com/products/product-catalog/view/mfs-360-enterprise-leadership-report/,"MFS 360 Enterprise Leadership Report: The layout of this report follows the standard MFS 360 report but this is based on the Enterprise Leadership competency model, not the UCF model. The report…",Knowledge & Skills
MFS 360 UCF Group Report,https://www.shl.com/products/product-catalog/view/mfs-360-ucf-group-report/,MFS 360 UCF Group Report: This report follows the standard layout of the 360 report but incorporates the average scores for a group of participants. The report can be generated for all…,Knowledge & Skills
MFS 360 UCF Performance Potential Dev Tips Report,https://www.shl.com/products/product-catalog/view/mfs-360-ucf-performance-potential-dev-tips-report/,MFS 360 UCF Performance Potential Dev Tips Report: This report is more or less identical to the standard MFS report but with an additional section that looks at the performance versus the potential and plots…,Knowledge & Skills
MFS 360 UCF Standard Report,https://www.shl.com/products/product-catalog/view/mfs-360-ucf-standard-report/,MFS 360 UCF Standard Report: This is the default MFS report. It is based on the UCF20 competency model. The report will only show those scales that were selected as part of the…,Knowledge & Skills
Micro Focus Unified Functional Testing (New),https://www.shl.com/products/product-catalog/view/micro-focus-unified-functional-testing-new/,Micro Focus Unified Functional Testing (New): Multi-choice test that measures the knowledge of automation testing using the QTP tool.,Knowledge & Skills
Microservices (New),https://www.shl.com/products/product-catalog/view/microservices-new/,"Microservices (New): Multi-choice test that measures the knowledge of Microservices architecture, SOA, and Microservices patterns.",Knowledge & Skills
Microsoft Dynamics Development (New),https://www.shl.com/products/product-catalog/view/microsoft-dynamics-development-new/,"Microsoft Dynamics Development (New): Multi-choice test that measures the knowledge of Microsoft Dynamics installation, sales process, service management, administration, configuration, entity…",Knowledge & Skills
Microsoft Excel 365 - Essentials (New),https://www.shl.com/products/product-catalog/view/microsoft-excel-365-essentials-new/,"Microsoft Excel 365 - Essentials (New): The Microsoft Excel 365 - Essentials simulation evaluates ability to perform certain operations in a simulated environment of MS Excel, and includes the…",Knowledge & Skills
Microsoft Excel 365 (New),https://www.shl.com/products/product-catalog/view/microsoft-excel-365-new/,"Microsoft Excel 365 (New): The Microsoft Excel 365 simulation evaluates ability to perform certain operations in a simulated environment of MS Excel, and includes the following topics…",Knowledge & Skills
Microsoft Outlook 2013 (adaptive),https://www.shl.com/products/product-catalog/view/microsoft-outlook-2013-adaptive/,"Microsoft Outlook 2013 (adaptive): The Microsoft Outlook 2013 (adaptive) test measures knowledge of Microsoft Outlook 2013. Designed for professionals, this test includes the following topics…",Knowledge & Skills
Microsoft PowerPoint 365 - Essentials (New),https://www.shl.com/products/product-catalog/view/microsoft-powerpoint-365-essentials-new/,"Microsoft PowerPoint 365 - Essentials (New): The Microsoft PowerPoint 365 - Essentials simulation evaluates ability to perform certain operations in a simulated environment of Microsoft PowerPoint, and…",Knowledge & Skills
Microsoft SQL Server 2014 Programming,https://www.shl.com/products/product-catalog/view/microsoft-sql-server-2014-programming/,Microsoft SQL Server 2014 Programming: The Microsoft SQL Server 2014 Programming test measures knowledge of Microsoft Structure Query Language (SQL) Server 2014 Programming. Designed for experienced…,Knowledge & Skills
Microsoft Windows Server 2012 Administration,https://www.shl.com/products/product-catalog/view/microsoft-windows-server-2012-administration/,Microsoft Windows Server 2012 Administration: The Microsoft Windows Server 2012 Administration test measures knowledge of Windows Server Administration. Designed for experienced Network Administrators…,Knowledge & Skills
Microsoft Word 365 - Essentials (New),https://www.shl.com/products/product-catalog/view/microsoft-word-365-essentials-new/,"Microsoft Word 365 - Essentials (New): The Microsoft Word 365 - Essentials simulation evaluates ability to perform certain operations in a simulated environment of Microsoft Word, and includes the…",Knowledge & Skills
Microsoft Word 365 (New),https://www.shl.com/products/product-catalog/view/microsoft-word-365-new/,"Microsoft Word 365 (New): The Microsoft Word 365 simulation evaluates ability to perform certain operations in a simulated environment of Microsoft Word, and includes the following…",Knowledge & Skills
Mineral Engineering (New),https://www.shl.com/products/product-catalog/view/mineral-engineering-new/,"Mineral Engineering (New): Multi-choice test that measures the knowledge of comminution and classification, physical separation process, particle technology, metallurgical…",Knowledge & Skills
Mining Engineering (New),https://www.shl.com/products/product-catalog/view/mining-engineering-new/,"Mining Engineering (New): Multi-choice test that measures the knowledge of mining methods, mineral processing, mining machinery, mineralogy, petrology and stratigraphy.",Knowledge & Skills
Mobility (New),https://www.shl.com/products/product-catalog/view/mobility-new/,Mobility (New): Multi-choice test that measures the knowledge on topics related to mobility and mobile computing.,Knowledge & Skills
Molecular Biology (New),https://www.shl.com/products/product-catalog/view/molecular-biology-new/,"Molecular Biology (New): Multi-choice test that measures the knowledge of molecular genetics, transgenics, rDNA technology, chromosomal genetics, transformation and related processes.",Knowledge & Skills
MongoDB (New),https://www.shl.com/products/product-catalog/view/mongodb-new/,"MongoDB (New): Multi-choice test that measures the conceptual knowledge of MongoDB like sharding, replication, indexing, security and storage. It also checks the knowledge of…",Knowledge & Skills
Motivation Questionnaire MQM5,https://www.shl.com/products/product-catalog/view/motivation-questionnaire-mqm5/,"Motivation Questionnaire MQM5: By understanding what motivates their staff, managers can unlock each individual’s full potential and direct their energies more constructively. This…",Knowledge & Skills
MQ Candidate Motivation Report,https://www.shl.com/products/product-catalog/view/mq-candidate-motivation-report/,MQ Candidate Motivation Report: The Candidate Motivation Report is designed as a feedback report for the individual. It provides an in-depth and easy-to-understand evaluation of an…,Knowledge & Skills
MQ Employee Motivation Report,https://www.shl.com/products/product-catalog/view/mq-employee-motivation-report/,"MQ Employee Motivation Report: The MQ Employee Motivation Report is ideal for use by line managers and those concerned with employee’s performance and well being, the Employee Motivation…",Knowledge & Skills
MQ Motivation Report Pack,https://www.shl.com/products/product-catalog/view/mq-motivation-report-pack/,"MQ Motivation Report Pack: The MQ Report pack consists of the Profile Chart, Employee Motivation Report and the Candidate Report and is a cost effective way of ensuring that your…",Knowledge & Skills
MQ Profile,https://www.shl.com/products/product-catalog/view/mq-profile/,MQ Profile: The profile chart is the Sten score graphical output of the MQ. It clearly shows the individual’s motivational drivers compared to the selected norm group as…,Knowledge & Skills
MS Access (New),https://www.shl.com/products/product-catalog/view/ms-access-new/,MS Access (New): Multi-choice test that measures the knowledge and basic understanding of MS Access programming.,Knowledge & Skills
MS Excel (New),https://www.shl.com/products/product-catalog/view/ms-excel-new/,"MS Excel (New): Multi-choice test that measures the ability to use MS Excel to maintain, organize, analyze and present numeric data.",Knowledge & Skills
MS Office Basic Computer Literacy (New),https://www.shl.com/products/product-catalog/view/ms-office-basic-computer-literacy-new/,"MS Office Basic Computer Literacy (New): Multi-choice test that measures the ability to use MS Word, MS Excel and MS PowerPoint to perform basic tasks on a computer.",Knowledge & Skills
MS Office Basic Computer Literacy (Sim) (New),https://www.shl.com/products/product-catalog/view/ms-office-basic-computer-literacy-sim-new/,"MS Office Basic Computer Literacy (Sim) (New): Simulation based test that measures the ability to use basic computer operations, browser navigation, MS office and email.",Knowledge & Skills
MS PowerPoint (New),https://www.shl.com/products/product-catalog/view/ms-powerpoint-new/,"MS PowerPoint (New): Multi-choice test that measures the knowledge of MS PowerPoint toolbars, slide layouts, animation, slideshow, slide designs and formats.",Knowledge & Skills
MS Word (New),https://www.shl.com/products/product-catalog/view/ms-word-new/,MS Word (New): Multi-choice test that measures the ability to use MS Word to record and save textual information.,Knowledge & Skills
MuleSoft Development (New),https://www.shl.com/products/product-catalog/view/mulesoft-development-new/,"MuleSoft Development (New): Multi-choice test that measures the knowledge of MuleSoft basic concepts, APIs and web services, Mule flow and scope, connectors and deployment.",Knowledge & Skills
Multitasking Ability,https://www.shl.com/products/product-catalog/view/multitasking-ability/,"Multitasking Ability: The Multitasking Ability assessment is a measure of one’s ability to adeptly work on more than one task simultaneously, while maintaining efficiency and…",Knowledge & Skills
Networking and Implementation (New),https://www.shl.com/products/product-catalog/view/networking-and-implementation-new/,"Networking and Implementation (New): Multi-choice test that measures the knowledge of networking devices, protocols, reference models, routing and implementation of networks.",Knowledge & Skills
Node.js (New),https://www.shl.com/products/product-catalog/view/node-js-new/,"Node.js (New): Multi-choice test that measures the basic knowledge of Node.js such as events, streams, file system, error handling, concurrency, DB handling and express…",Knowledge & Skills
Nursing (New),https://www.shl.com/products/product-catalog/view/nursing-new/,Nursing (New): Multi-choice test that measures the knowledge of carrying out various nursing tasks.,Knowledge & Skills
Occupational Personality Questionnaire OPQ32r,https://www.shl.com/products/product-catalog/view/occupational-personality-questionnaire-opq32r/,"Occupational Personality Questionnaire OPQ32r: The SHL Occupational Personality Questionnaire, the OPQ32, is one of the most widely used and respected measures of workplace behavioural style in the world…",Knowledge & Skills
Operations Management (New),https://www.shl.com/products/product-catalog/view/operations-management-new/,"Operations Management (New): Multi-choice test that measures the knowledge of planning, product design and development, quality management and supply chain management.",Knowledge & Skills
OPQ Candidate Plus Report,https://www.shl.com/products/product-catalog/view/opq-candidate-plus-report/,OPQ Candidate Plus Report: A brief narrative OPQ (Occupational Personality Questionnaire) report designed to be given to the individual who completed the OPQ.,Knowledge & Skills
OPQ Candidate Report 2.0,https://www.shl.com/products/product-catalog/view/opq-candidate-report-2-0/,OPQ Candidate Report 2.0: A brief narrative OPQ (Occupational Personality Questionnaire) report structure around 3 OPQ profile sections which can be given to candidates to keep after a…,Knowledge & Skills
OPQ Emotional Intelligence Report,https://www.shl.com/products/product-catalog/view/opq-emotional-intelligence-report/,OPQ Emotional Intelligence Report: This OPQ (Occupational Personality Questionnaire) report explores how a person manages feelings and relationships with other people.  It is intended for use in…,Knowledge & Skills
OPQ Leadership Report,https://www.shl.com/products/product-catalog/view/opq-leadership-report/,OPQ Leadership Report: This OPQ (Occupational Personality Questionnaire) report provides a detailed analysis of an individual's leadership potential.  It is based on SHL's leading…,Knowledge & Skills
OPQ Manager Plus Report,https://www.shl.com/products/product-catalog/view/opq-manager-plus-report/,OPQ Manager Plus Report: This concise OPQ (Occupational Personality Questionnaire) report is designed for use with and by managers.  It uses clear succinct bullets and tables for ease…,Knowledge & Skills
OPQ Manager Plus Report 2.0,https://www.shl.com/products/product-catalog/view/opq-manager-plus-report-2-0/,OPQ Manager Plus Report 2.0: This concise OPQ (Occupational Personality Questionnaire) report is designed for use with and by managers. It uses clear succinct bullets and tables for ease…,Knowledge & Skills
OPQ Maximising your Learning Report,https://www.shl.com/products/product-catalog/view/opq-maximising-your-learning-report/,OPQ Maximising your Learning Report: This OPQ (Occupational Personality Questionnaire) report is designed to help people get the most from their development.  It summarises the preferred approach…,Knowledge & Skills
OPQ MQ Sales Report,https://www.shl.com/products/product-catalog/view/opq-mq-sales-report/,OPQ MQ Sales Report: This OPQ (Occupational Personality Questionnaire) report provides a graphical and narrative summary of an individual's natural style that is critical to sales…,Knowledge & Skills
OPQ Premium Plus Report,https://www.shl.com/products/product-catalog/view/opq-premium-plus-report/,"OPQ Premium Plus Report: This OPQ (Occupational Personality Questionnaire) report contains a selection of reports including OPQ profile, user report, manager plus report, candidate…",Knowledge & Skills
OPQ Premium Plus Report 2.0,https://www.shl.com/products/product-catalog/view/opq-premium-plus-report-2-0/,"OPQ Premium Plus Report 2.0 : This OPQ (Occupational Personality Questionnaire) report contains a selection of reports including OPQ profile, user report, manager plus report, candidate…",Knowledge & Skills
Social Media (New),https://www.shl.com/products/product-catalog/view/social-media-new/,Social Media (New): Multi-choice test that measures the knowledge about the different social media platforms.,Knowledge & Skills
Software Business Analysis,https://www.shl.com/products/product-catalog/view/software-business-analysis/,"Software Business Analysis: The Software Business Analysis test measures ability to acquire and understand business requirements for an IT project, develop technical assets in support of…",Knowledge & Skills
SonarQube (New),https://www.shl.com/products/product-catalog/view/sonarqube-new/,"SonarQube (New): Multi-choice test that measures the knowledge of SonarQube, integration tests, Sonar symbols, wildcards, quality cover and Sonar architecture.",Knowledge & Skills
Spelling (U.S.) (New),https://www.shl.com/products/product-catalog/view/spelling-u-s-new/,Spelling (U.S.) (New): Multi-choice test that measures the knowledge of correct spellings in English and the ability to identify spelling errors in sentences.,Knowledge & Skills
Split Screen Typing Test - Form 1,https://www.shl.com/products/product-catalog/view/split-screen-typing-test-form-1/,"Split Screen Typing Test - Form 1: This test measures speed and accuracy in typing text presented on the computer screen. In this assessment, the text original is displayed directly above the…",Knowledge & Skills
Spring (New),https://www.shl.com/products/product-catalog/view/spring-new/,"Spring (New): Multi-choice test that measures the knowledge of Spring core, AOP, IOC container and transactions.",Knowledge & Skills
SQL (New),https://www.shl.com/products/product-catalog/view/sql-new/,"SQL (New): Multi-choice test that measures the knowledge of SQL queries, data manipulation and transaction processing.",Knowledge & Skills
SQL Server (New),https://www.shl.com/products/product-catalog/view/sql-server-new/,"SQL Server (New): Multi-choice test that measures the knowledge of basic SQL queries, creating and altering tables, filtering, grouping, aggregation in SQL and querying multiple…",Knowledge & Skills
